{
  "id": "moss-to-jen-productivity-boundary",
  "handoff_type": "return",
  "from_owner": "moss",
  "to_owner": "jen",
  "decision_owner": "jen",
  "return_to_owner": "jen",
  "objective": "Return a productivity/framing decision to Jen after Moss identifies it is outside technical ownership.",
  "context": "The next action is commitment framing, not infrastructure or runtime implementation.",
  "decisions_made": [
    "Moss should not mutate productivity state or reframe commitments by default."
  ],
  "open_constraints": [
    "Any later technical automation should come back to Moss as a bounded execution request."
  ],
  "blockers": [],
  "next_action": "Jen decides the productivity framing and, if needed, creates a bounded technical request for Moss.",
  "privacy_constraints": [
    "No private routine details or personal context in public examples."
  ],
  "private_data_level": "public",
  "created_at": "2026-05-21T18:45:00Z"
}
