{
  "id": "handoff-denholm-moss-architecture-check",
  "handoff_type": "execution",
  "from_owner": "denholm",
  "to_owner": "moss",
  "decision_owner": "denholm",
  "return_to_owner": "denholm",
  "objective": "Prepare a reviewed technical implementation proposal for the public scaffold.",
  "context": "Product stewardship has defined the desired direction; Moss should translate it into bounded technical artifacts and validation evidence.",
  "decisions_made": [
    "Keep private deployment state outside the public scaffold.",
    "Use review gates before enabling new runtime authority."
  ],
  "open_constraints": [
    "No credentials, host-control mounts, provider state, private topology, or unredacted command output are included in this handoff."
  ],
  "blockers": [],
  "next_action": "Moss drafts the technical proposal, runs review gates, records validation commands, and returns stewardship decisions to Denholm.",
  "privacy_constraints": [
    "Use public-safe summaries only.",
    "Reference private evidence through opaque private-ref identifiers when needed."
  ],
  "private_data_level": "public",
  "created_at": "2026-05-21T12:00:00Z"
}
