{
  "id": "denholm-to-moss-technical-execution",
  "handoff_type": "execution",
  "from_owner": "denholm",
  "to_owner": "moss",
  "decision_owner": "denholm",
  "return_to_owner": "denholm",
  "objective": "Implement a product-approved technical scaffold change.",
  "context": "Denholm owns the product/stewardship decision; Moss owns the bounded technical implementation and validation evidence.",
  "decisions_made": [
    "The scaffold should expose public-safe architecture contracts."
  ],
  "open_constraints": [
    "Moss must not change the owner map or product direction without returning to Denholm."
  ],
  "blockers": [],
  "next_action": "Moss creates the technical patch, runs validation, and returns review evidence to Denholm.",
  "privacy_constraints": [
    "No private deployment state, credentials, provider state, or unredacted command output in the public handoff."
  ],
  "private_data_level": "public",
  "created_at": "2026-05-21T18:45:00Z"
}
